{
  "schema": "veribiota.checks.v1",
  "toolchain": {
    "lean": "4.12.0",
    "mathlib": "5f8c1ad",
    "tactics": "Invariant.lin@0.1"
  },
  "modelHash": "sha256:cafebabe0123456789cafebabe0123456789cafebabe0123456789cafebabe01",
  "generatedAt": "2025-11-10T17:00:00Z",
  "checks": [
    {
      "type": "positivity_counts",
      "species": [
        "I",
        "R",
        "S"
      ]
    },
    {
      "type": "lin_invariant",
      "name": "N",
      "proofId": "9c2a",
      "weights": {
        "I": 1,
        "R": 1,
        "S": 1
      },
      "tolerance": {
        "mode": "absolute",
        "value": 0
      },
      "strict": true
    }
  ]
}
